"DESCRIPTION","DURATION IN MS","NAME","PARENT SUITE","START TIME","STATUS","STOP TIME","SUB SUITE","SUITE","TEST CLASS","TEST METHOD"
"","26","Test that create_new_booking returns status 200","tests","Fri Feb 07 15:16:13 GMT 2025","passed","Fri Feb 07 15:16:13 GMT 2025","TestBooking","test_booking","",""
"","32","Test that get_all_booking_ids returns more than zero bookings","tests","Fri Feb 07 15:16:12 GMT 2025","passed","Fri Feb 07 15:16:13 GMT 2025","TestBooking","test_booking","",""
"","46","Test that a new booking is available in the list of all existing bookings","tests","Fri Feb 07 15:16:13 GMT 2025","passed","Fri Feb 07 15:16:13 GMT 2025","TestBooking","test_booking","",""
"","46","Test that a specific booking contains all data specified during its creation","tests","Fri Feb 07 15:16:13 GMT 2025","passed","Fri Feb 07 15:16:13 GMT 2025","TestBooking","test_booking","",""
"","32","Test that get_all_booking_ids returns status 200","tests","Fri Feb 07 15:16:12 GMT 2025","passed","Fri Feb 07 15:16:12 GMT 2025","TestBooking","Tests for Restful-Booker","",""
"","67","Test that once booking is deleted it is not available in the list of all bookings","tests","Fri Feb 07 15:16:13 GMT 2025","passed","Fri Feb 07 15:16:13 GMT 2025","TestBooking","test_booking","",""
"","47","Test that delete a booking returns status 201","tests","Fri Feb 07 15:16:13 GMT 2025","passed","Fri Feb 07 15:16:13 GMT 2025","TestBooking","test_booking","",""
"","48","Test that a first name can be updated","tests","Fri Feb 07 15:16:13 GMT 2025","passed","Fri Feb 07 15:16:13 GMT 2025","TestBooking","test_booking","",""
